{
  "content_keys": [
    "eyebrow",
    "subtitle",
    "takeaways",
    "title"
  ],
  "elements": [
    {
      "bbox": {
        "height": 540.0,
        "width": 960.0,
        "x": 0.0,
        "y": 0.0
      },
      "element_id": "background",
      "kind": "rect",
      "role": "background",
      "source_ref": null,
      "text": null
    },
    {
      "bbox": {
        "height": 30.0,
        "width": 18.0,
        "x": 712.0,
        "y": 322.0
      },
      "element_id": "metric-bar-1",
      "kind": "rect",
      "role": "decorative",
      "source_ref": null,
      "text": null
    },
    {
      "bbox": {
        "height": 48.0,
        "width": 18.0,
        "x": 742.0,
        "y": 304.0
      },
      "element_id": "metric-bar-2",
      "kind": "rect",
      "role": "decorative",
      "source_ref": null,
      "text": null
    },
    {
      "bbox": {
        "height": 66.0,
        "width": 18.0,
        "x": 772.0,
        "y": 286.0
      },
      "element_id": "metric-bar-3",
      "kind": "rect",
      "role": "decorative",
      "source_ref": null,
      "text": null
    },
    {
      "bbox": {
        "height": 32.0,
        "width": 420.0,
        "x": 72.0,
        "y": 64.0
      },
      "element_id": "eyebrow",
      "kind": "text",
      "role": "eyebrow",
      "source_ref": "canvas_spec.content.eyebrow",
      "text": "NEXT"
    },
    {
      "bbox": {
        "height": 110.0,
        "width": 700.0,
        "x": 72.0,
        "y": 110.0
      },
      "element_id": "title",
      "kind": "text",
      "role": "title",
      "source_ref": "canvas_spec.content.title",
      "text": "下一步观测"
    },
    {
      "bbox": {
        "height": 66.0,
        "width": 640.0,
        "x": 72.0,
        "y": 244.0
      },
      "element_id": "subtitle",
      "kind": "text",
      "role": "subtitle",
      "source_ref": "canvas_spec.content.subtitle",
      "text": "把研究结果转成可执行的观测闭环。"
    },
    {
      "bbox": {
        "height": 126.0,
        "width": 250.0,
        "x": 72.0,
        "y": 344.0
      },
      "element_id": "takeaway-card-1",
      "kind": "rect",
      "role": "container",
      "source_ref": "canvas_spec.content.takeaways[]",
      "text": null
    },
    {
      "bbox": {
        "height": 30.0,
        "width": 64.0,
        "x": 94.0,
        "y": 366.0
      },
      "element_id": "takeaway-index-1",
      "kind": "text",
      "role": "takeaway-index-1",
      "source_ref": "canvas_spec.content.takeaways[]",
      "text": "01"
    },
    {
      "bbox": {
        "height": 54.0,
        "width": 202.0,
        "x": 94.0,
        "y": 404.0
      },
      "element_id": "takeaway-1",
      "kind": "text",
      "role": "takeaway-1",
      "source_ref": "canvas_spec.content.takeaways[]",
      "text": "连续监测"
    },
    {
      "bbox": {
        "height": 126.0,
        "width": 250.0,
        "x": 340.0,
        "y": 344.0
      },
      "element_id": "takeaway-card-2",
      "kind": "rect",
      "role": "container",
      "source_ref": "canvas_spec.content.takeaways[]",
      "text": null
    },
    {
      "bbox": {
        "height": 30.0,
        "width": 64.0,
        "x": 362.0,
        "y": 366.0
      },
      "element_id": "takeaway-index-2",
      "kind": "text",
      "role": "takeaway-index-2",
      "source_ref": "canvas_spec.content.takeaways[]",
      "text": "02"
    },
    {
      "bbox": {
        "height": 54.0,
        "width": 202.0,
        "x": 362.0,
        "y": 404.0
      },
      "element_id": "takeaway-2",
      "kind": "text",
      "role": "takeaway-2",
      "source_ref": "canvas_spec.content.takeaways[]",
      "text": "现场复核"
    },
    {
      "bbox": {
        "height": 126.0,
        "width": 250.0,
        "x": 608.0,
        "y": 344.0
      },
      "element_id": "takeaway-card-3",
      "kind": "rect",
      "role": "container",
      "source_ref": "canvas_spec.content.takeaways[]",
      "text": null
    },
    {
      "bbox": {
        "height": 30.0,
        "width": 64.0,
        "x": 630.0,
        "y": 366.0
      },
      "element_id": "takeaway-index-3",
      "kind": "text",
      "role": "takeaway-index-3",
      "source_ref": "canvas_spec.content.takeaways[]",
      "text": "03"
    },
    {
      "bbox": {
        "height": 54.0,
        "width": 202.0,
        "x": 630.0,
        "y": 404.0
      },
      "element_id": "takeaway-3",
      "kind": "text",
      "role": "takeaway-3",
      "source_ref": "canvas_spec.content.takeaways[]",
      "text": "风险沟通"
    }
  ],
  "page": 3,
  "semantic_source": "CanvasSpec",
  "template_id": "summary-final",
  "theme_id": "warm-editorial",
  "version": "svglide-semantic-map/v1"
}
